{"digest":{"algorithm":"sha-256","value":"3fb9ceebc842118d85a82da3ae10b568d646367dc2764b6288fca08a51af7b56"},"id":"urn:receipt:turn-3","issuedAt":"2026-09-01T12:00:00Z","issuer":"urn:engram:engram","kind":"RecallReceipt","payload":{"action":"recall","audience":"self","context":{"id":"memory/technical","path":["memory","technical"]},"delivered":[{"memoryId":"why-missing-piece","publisher":"urn:engram:why","readDecision":{"code":null,"effect":"allow","ruleId":"allow-why"}}],"injected":true,"purpose":"session-recall","receiverRule":{"ruleId":"allow-technical"},"selected":[{"contentDigest":{"algorithm":"sha256","value":"aaaaaaaaaaaaaaaaaaaaaaaaaaaaaaaaaaaaaaaaaaaaaaaaaaaaaaaaaaaaaaaa"},"contributions":[{"publisher":"urn:engram:why","rank":1}],"memoryId":"why-missing-piece","publisher":"urn:engram:why","score":0.03278688524590164}],"sources":[{"policyDecision":{"code":null,"effect":"allow","ruleId":"local:self"},"publisher":"urn:engram:engram","role":"local","storeDigest":{"algorithm":"sha256","value":"1111111111111111111111111111111111111111111111111111111111111111"},"traceOutcome":"matched","weight":1},{"policyDecision":{"code":null,"effect":"allow","ruleId":"allow-why"},"publisher":"urn:engram:why","role":"remote","storeDigest":{"algorithm":"sha256","value":"2222222222222222222222222222222222222222222222222222222222222222"},"traceOutcome":"matched","weight":2},{"policyDecision":{"code":"EXPLICIT_DENY","effect":"deny","ruleId":"deny-blocks"},"publisher":"urn:engram:blocks","role":"remote","storeDigest":{"algorithm":"sha256","value":"3333333333333333333333333333333333333333333333333333333333333333"},"traceOutcome":"policy-denied","weight":3}],"transformation":"weighted-rrf-v1","turnId":"turn-3"},"payloadMediaType":"application/vnd.lighthouse.recall-receipt+json","protocolVersion":"0.1"}
