{"digest":{"algorithm":"sha-256","value":"1baf6c129dbe479dabfa66d91b8ea8e96563309949ed67818e7a102e3e5a1352"},"extensions":{"engram:diagnostics":[],"engram:receiverDecisions":[{"action":"recall","code":null,"effect":"allow","phase":"query","publisher":"urn:engram:pilot-publisher","ruleId":"pilot-grant"}],"engram:sourceDigestBasis":"canonical-received-trace-v1","engram:traceSnapshots":[{"candidates":[],"context":{"id":"memory/technical","path":["memory","technical"]},"decision":{"code":"EXPLICIT_DENY","effect":"deny","ruleId":"pilot-grant"},"disclosureId":"d168007a-a5a9-4013-a086-0a16c4853167","publisher":"urn:engram:pilot-publisher","queryDigest":{"algorithm":"sha256","value":"f5105ef3db65cd99f3d576b1286468bc684cd4eae88d2b980914f124a480bbda"},"turnId":"208caba9-af39-4af8-998e-f7d8aaa49702"}],"engram:unavailableSources":[]},"id":"urn:engram:pilot-receiver:receipt:71d7f2d9-70fd-4d3b-b375-86860dc64d44","issuedAt":"2026-09-07T05:46:41.615898+00:00","issuer":"urn:engram:pilot-receiver","kind":"RecallReceipt","payload":{"action":"recall","audience":"self","context":{"id":"memory/technical","path":["memory","technical"]},"delivered":[],"injected":false,"purpose":"session-recall","receiverRule":{"ruleId":"pilot-grant"},"selected":[],"sources":[{"policyDecision":{"code":null,"effect":"allow","ruleId":"pilot-grant"},"publisher":"urn:engram:pilot-publisher","role":"remote","storeDigest":{"algorithm":"sha256","value":"2cc8a3b9d50b07342123b83128793d493df68474f9293add36b68fdcdab7c460"},"traceOutcome":"policy-denied","weight":1}],"transformation":"weighted-rrf-v1","turnId":"pilot-policy_withdrawn"},"payloadMediaType":"application/vnd.lighthouse.recall-receipt+json","protocolVersion":"0.1"}
