{"digest":{"algorithm":"sha-256","value":"e77cf55c9e63bd205e15c5cba0651b963c17d661b4c533da06e8584e666191e5"},"extensions":{"engram:diagnostics":[],"engram:receiverDecisions":[{"action":"recall","code":null,"effect":"allow","phase":"query","publisher":"urn:engram:pilot-publisher","ruleId":"pilot-grant"}],"engram:sourceDigestBasis":"canonical-received-trace-v1","engram:traceSnapshots":[{"candidates":[],"context":{"id":"memory/technical","path":["memory","technical"]},"decision":{"code":null,"effect":"allow","ruleId":"pilot-grant"},"disclosureId":"4a485c50-270e-4203-bc71-883e4447aeec","publisher":"urn:engram:pilot-publisher","queryDigest":{"algorithm":"sha256","value":"f5105ef3db65cd99f3d576b1286468bc684cd4eae88d2b980914f124a480bbda"},"turnId":"b8634ae0-4f45-4929-8521-931108dbaee2"}],"engram:unavailableSources":[]},"id":"urn:engram:pilot-receiver:receipt:e78a5022-7d41-4d67-9f04-a1217db38da6","issuedAt":"2026-09-07T05:46:41.657470+00:00","issuer":"urn:engram:pilot-receiver","kind":"RecallReceipt","payload":{"action":"recall","audience":"self","context":{"id":"memory/technical","path":["memory","technical"]},"delivered":[],"injected":false,"purpose":"session-recall","receiverRule":{"ruleId":"pilot-grant"},"selected":[],"sources":[{"policyDecision":{"code":null,"effect":"allow","ruleId":"pilot-grant"},"publisher":"urn:engram:pilot-publisher","role":"remote","storeDigest":{"algorithm":"sha256","value":"15d884e51542b5f6444fbb0fab1d3e27fa28111102424efd17d492f47bb20faa"},"traceOutcome":"absent","weight":1}],"transformation":"weighted-rrf-v1","turnId":"pilot-unshared"},"payloadMediaType":"application/vnd.lighthouse.recall-receipt+json","protocolVersion":"0.1"}
