{"digest":{"algorithm":"sha-256","value":"3312e4e9125fc80204cc323669481a14dbdc04a45a4388969e6ab90962791bc8"},"extensions":{"engram:diagnostics":[],"engram:receiverDecisions":[{"action":"recall","code":null,"effect":"allow","phase":"query","publisher":"urn:engram:pilot-publisher","ruleId":"pilot-grant"},{"action":"recall","code":null,"effect":"allow","phase":"read","publisher":"urn:engram:pilot-publisher","ruleId":"pilot-grant"},{"action":"read","code":null,"effect":"allow","phase":"read","publisher":"urn:engram:pilot-publisher","ruleId":"pilot-grant"},{"action":"inject_context","code":null,"effect":"allow","phase":"read","publisher":"urn:engram:pilot-publisher","ruleId":"pilot-grant"},{"action":"recall","code":null,"effect":"allow","phase":"delivery","publisher":"urn:engram:pilot-publisher","ruleId":"pilot-grant"},{"action":"read","code":null,"effect":"allow","phase":"delivery","publisher":"urn:engram:pilot-publisher","ruleId":"pilot-grant"},{"action":"inject_context","code":null,"effect":"allow","phase":"delivery","publisher":"urn:engram:pilot-publisher","ruleId":"pilot-grant"}],"engram:sourceDigestBasis":"canonical-received-trace-v1","engram:traceSnapshots":[{"candidates":[{"audiences":["commons"],"contentDigest":{"algorithm":"sha256","value":"2c95a2e3874f845d4fa8e34d78e69a461bbc4303d026e56a78743b7f2a795b70"},"lane":"personal","layer":"episode","memoryId":"0df5a1fc-867d-442c-b89b-499ace7bf58b","rank":1}],"context":{"id":"memory/technical","path":["memory","technical"]},"decision":{"code":null,"effect":"allow","ruleId":"pilot-grant"},"disclosureId":"6537170e-5187-414a-949b-11065efa338f","publisher":"urn:engram:pilot-publisher","queryDigest":{"algorithm":"sha256","value":"f5105ef3db65cd99f3d576b1286468bc684cd4eae88d2b980914f124a480bbda"},"turnId":"bcc1d05c-f58f-4c63-a19f-95235def0469"}],"engram:unavailableSources":[]},"id":"urn:engram:pilot-receiver:receipt:923c59c9-01e0-47e0-a52a-506651e3d6c6","issuedAt":"2026-09-07T05:46:41.535625+00:00","issuer":"urn:engram:pilot-receiver","kind":"RecallReceipt","payload":{"action":"recall","audience":"self","context":{"id":"memory/technical","path":["memory","technical"]},"delivered":[{"memoryId":"0df5a1fc-867d-442c-b89b-499ace7bf58b","publisher":"urn:engram:pilot-publisher","readDecision":{"code":null,"effect":"allow","ruleId":"pilot-grant"}}],"injected":true,"purpose":"session-recall","receiverRule":{"ruleId":"pilot-grant"},"selected":[{"contentDigest":{"algorithm":"sha256","value":"2c95a2e3874f845d4fa8e34d78e69a461bbc4303d026e56a78743b7f2a795b70"},"contributions":[{"publisher":"urn:engram:pilot-publisher","rank":1}],"memoryId":"0df5a1fc-867d-442c-b89b-499ace7bf58b","publisher":"urn:engram:pilot-publisher","score":0.01639344262295082}],"sources":[{"policyDecision":{"code":null,"effect":"allow","ruleId":"pilot-grant"},"publisher":"urn:engram:pilot-publisher","role":"remote","storeDigest":{"algorithm":"sha256","value":"64fe88ddf7a1ad00aa37344cd05cd772a70806dda4f06a78f28336ff6546451d"},"traceOutcome":"matched","weight":1}],"transformation":"weighted-rrf-v1","turnId":"pilot-allowed"},"payloadMediaType":"application/vnd.lighthouse.recall-receipt+json","protocolVersion":"0.1"}
