{"digest":{"algorithm":"sha-256","value":"7cfec381d934c815e28dd099dcbf4e94c55d299c3fcd08b0ceb3aa2ae6e644c5"},"extensions":{"engram:diagnostics":[],"engram:receiverDecisions":[{"action":"recall","code":null,"effect":"allow","phase":"query","publisher":"urn:engram:pilot-publisher","ruleId":"pilot-grant"},{"action":"recall","code":null,"effect":"allow","phase":"read","publisher":"urn:engram:pilot-publisher","ruleId":"pilot-grant"},{"action":"read","code":"NO_MATCHING_ALLOW","effect":"deny","phase":"read","publisher":"urn:engram:pilot-publisher","ruleId":null},{"action":"inject_context","code":"NO_MATCHING_ALLOW","effect":"deny","phase":"read","publisher":"urn:engram:pilot-publisher","ruleId":null}],"engram:sourceDigestBasis":"canonical-received-trace-v1","engram:traceSnapshots":[{"candidates":[{"audiences":["commons"],"contentDigest":{"algorithm":"sha256","value":"2c95a2e3874f845d4fa8e34d78e69a461bbc4303d026e56a78743b7f2a795b70"},"lane":"personal","layer":"episode","memoryId":"0df5a1fc-867d-442c-b89b-499ace7bf58b","rank":1}],"context":{"id":"memory/technical","path":["memory","technical"]},"decision":{"code":null,"effect":"allow","ruleId":"pilot-grant"},"disclosureId":"0a9d6d15-cc3f-4521-b2df-551dca7a1691","publisher":"urn:engram:pilot-publisher","queryDigest":{"algorithm":"sha256","value":"f5105ef3db65cd99f3d576b1286468bc684cd4eae88d2b980914f124a480bbda"},"turnId":"4fd055d5-400e-447e-a841-afeaee5a2085"}],"engram:unavailableSources":[]},"id":"urn:engram:pilot-receiver:receipt:422f19ae-9fc8-4c95-bc28-5600bbb8358c","issuedAt":"2026-09-07T05:46:41.581986+00:00","issuer":"urn:engram:pilot-receiver","kind":"RecallReceipt","payload":{"action":"recall","audience":"self","context":{"id":"memory/technical","path":["memory","technical"]},"delivered":[],"injected":false,"purpose":"session-recall","receiverRule":{"ruleId":"pilot-grant"},"selected":[{"contentDigest":{"algorithm":"sha256","value":"2c95a2e3874f845d4fa8e34d78e69a461bbc4303d026e56a78743b7f2a795b70"},"contributions":[{"publisher":"urn:engram:pilot-publisher","rank":1}],"memoryId":"0df5a1fc-867d-442c-b89b-499ace7bf58b","publisher":"urn:engram:pilot-publisher","score":0.01639344262295082}],"sources":[{"policyDecision":{"code":null,"effect":"allow","ruleId":"pilot-grant"},"publisher":"urn:engram:pilot-publisher","role":"remote","storeDigest":{"algorithm":"sha256","value":"384738c6b121af5a14c90574fc14e94403e9080b36b45b87adb6b83756eba0e7"},"traceOutcome":"matched","weight":1}],"transformation":"weighted-rrf-v1","turnId":"pilot-denied"},"payloadMediaType":"application/vnd.lighthouse.recall-receipt+json","protocolVersion":"0.1"}
